{
  "$schema": "../docs/evidence-record.schema.json",
  "schema_version": "1.0",
  "record_id": "artifact-gate-python-2026-09-17",
  "job": "Confirm that an approved review still refers to the exact artifact bytes before a publish step.",
  "implementation": {
    "team_id": "cross-agent-artifact-gate",
    "implementation_id": "python/artifact-gate",
    "runtime": "python",
    "runtime_version": "3.12.14",
    "model": null,
    "model_version_or_digest": null,
    "environment": "Local macOS environment; Python standard library only"
  },
  "source_revision": "f59e7d383d2e2be618c3d68bb9cb5025ae6981d1",
  "verification_status": "Partial",
  "tested_at": "2026-09-16T23:04:00Z",
  "input_scope": {
    "description": "Temporary fictional UTF-8 text, including Japanese, and synthetic review JSON.",
    "sensitive_data_redacted": false,
    "fixtures_or_sources": [
      "examples/artifact-gate/test_verify_gate.py"
    ]
  },
  "observed_result": "The dependency-free unit test suite ran 12 tests in 0.007 seconds and returned OK. No AI model, network call, publisher integration, external write, or purchase was run.",
  "checks": [
    {
      "name": "Dependency-free artifact gate unit test suite",
      "result": "pass",
      "evidence": "docs/artifact-gate-test-evidence.md records the command, covered cases, elapsed time, and result."
    },
    {
      "name": "AI model execution",
      "result": "not_run",
      "evidence": "The published test record explicitly states that no AI model was run."
    },
    {
      "name": "Live publisher integration",
      "result": "not_run",
      "evidence": "The published test record explicitly excludes publisher integration and external writes."
    }
  ],
  "human_approval_boundary": {
    "required_before": [
      "publish"
    ],
    "other_boundary": null,
    "enforced_by_runtime": false,
    "enforcement_evidence": null
  },
  "failures": [],
  "known_limits": [
    "No reviewer authentication",
    "No storage-permission enforcement",
    "No signature validation",
    "No semantic fact checking",
    "No live platform verification",
    "No concurrent-file mutation protection",
    "No performance benchmark",
    "A digest match is not trustworthy approval if the review record can be forged",
    "Other Python versions and operating systems were not run"
  ],
  "evidence_artifacts": [
    {
      "label": "Human-readable test evidence",
      "uri": "../../docs/artifact-gate-test-evidence.md",
      "sha256": null
    },
    {
      "label": "Verifier",
      "uri": "./artifact-gate/verify_gate.py",
      "sha256": null
    },
    {
      "label": "Unit tests",
      "uri": "./artifact-gate/test_verify_gate.py",
      "sha256": null
    },
    {
      "label": "Pinned source commit",
      "uri": "https://github.com/BotShelfVampire/botshelf-ai-team-registry/commit/f59e7d383d2e2be618c3d68bb9cb5025ae6981d1",
      "sha256": null
    }
  ],
  "reviewer": null,
  "notes": "The test time is approximate to the minute as recorded in the human-readable evidence. Partial means the deterministic checker was tested, not that an AI Team or live publication workflow was verified."
}
